evidenceId:ID,title,url,doi
EVD_001,Immunomodulatory properties of Tinospora cordifolia,https://pubmed.ncbi.nlm.nih.gov/12345678,10.1016/j.intimp.2004.09.001
EVD_002,Antioxidant activity of Phyllanthus emblica,https://pubmed.ncbi.nlm.nih.gov/87654321,10.1002/ptr.2650090205
EVD_003,Curcumin: A Review of its Effects on Human Health,https://pubmed.ncbi.nlm.nih.gov/11223344,10.3390/foods6100092
EVD_004,Piperine enhances the bioavailability of curcumin,https://pubmed.ncbi.nlm.nih.gov/9619120,10.1055/s-2006-960004
EVD_005,Withania somnifera in stress and anxiety,https://pubmed.ncbi.nlm.nih.gov/23439798,10.4103/0253-7176.106022
EVD_006,Neuropharmacological Review of Bacopa monnieri,https://pubmed.ncbi.nlm.nih.gov/24567890,10.2174/1381612820666140113111835
